Title,Company,Experience,Salary,Location,Description,Tags,Posted,URL
Freshers Walk-in  (Java),Maintwiz Technologies,0-1 Yrs,Not disclosed,Chennai,span,"Java, software development life cycle, front end, postgresql, SaaS, concept design, hibernate, aws",8 Days Ago,https://www.naukri.com/job-listings-freshers-walk-in-java-maintwiz-technologies-private-limited-chennai-0-to-1-years-150324905438?src=directSearch&sid=17112148624933509&xp=1&px=1
Software Engineer Trainee (Male Fresher) Porur (java/python/C#/ C++),Soft Suave,0-1 Yrs,3-4 Lacs PA,Chennai(Porur),span,"Software Development, Java, C++, Python, Development, Training, Software, C#",23 Days Ago,https://www.naukri.com/job-listings-software-engineer-trainee-male-fresher-porur-java-python-c-c-soft-suave-chennai-0-to-1-years-290224009482
Java Developer 1+/2+/3+ Fresher,Oasis Technology And Consulting Services,0 Yrs,4.5-9.5 Lacs PA,"Chennai, Tamil Nadu(OMR)",span,"Java, Java Spring Boot, Software Testing, Java Fullstack, Java Development, JEE, Java Coding, Full Stack",19 Days Ago,https://www.naukri.com/job-listings-java-developer-1-2-3-fresher-oasis-technology-and-consulting-services-chennai-tamil-nadu-0-to-0-years-040324000973
Back End Developer,,,,,div,,,
Fresher Graduate,,,,,div,,,
Android Developer,,,,,div,,,
Python Software Developer,,,,,div,,,
Dot Net Developer,,,,,div,,,
"Hiring For Fresher JAVA Developer - Leading IT Company, Chennai...",JTS Jobs Consultancy,0 Yrs,2.5-3.5 Lacs PA,Chennai,span,"Java, Core Java, BCA, B.Sc, Spring Mvc, BE/B.Tech, J2Ee, MCA",Few Hours Ago,https://www.naukri.com/job-listings-hiring-for-fresher-java-developer-leading-it-company-chennai-jts-jobs-consultancy-chennai-0-to-0-years-280423008563
Java Developer (0- 1 year),Zakapps Software,0-1 Yrs,Not disclosed,Chennai,span,"Web technologies, Java J2Ee Developer, Agile, Time, Application software, Testing, Development, Java Development",30+ Days Ago,https://www.naukri.com/job-listings-java-developer-0-1-year-zakapps-software-private-limited-chennai-0-to-1-years-170418501347
Java Developer,P S International HR Consultants,0-4 Yrs,Not disclosed,Chennai,span,"spring boot, Core Java, Version control, JBoss, Defect tracking, Software development life cycle, J2Ee, MVC",30+ Days Ago,https://www.naukri.com/job-listings-java-developer-p-s-international-hr-consultants-chennai-0-to-4-years-081022500073
Software Trainees / Developers (Freshers),Apzzo,0-1 Yrs,2-3 Lacs PA,Chennai,span,"software trainee, Software Development, fresher, Java, CSS, Mobile Development, Ios Development, HTML",7 Days Ago,https://www.naukri.com/job-listings-software-trainees-developers-freshers-apzzo-technologies-private-limited-chennai-0-to-1-years-160324006669
Software Developer,LateShipment.com,0-2 Yrs,Not disclosed,Chennai,span,"Core Java, Automation, jQuery, Coding, MySQL, Wordpress, Agile, PHP",1 Day Ago,https://www.naukri.com/job-listings-software-developer-lateshipment-com-chennai-0-to-2-years-220324500632
Junior Software Developer Fresher 2024 Batch,Ficusoft Technologies,0-1 Yrs,3-6 Lacs PA,"Chennai, Tamil Nadu",span,"Coding, Programming, CSS, Software Engineering, Computer Science, HTML, Languages, Development",1 Day Ago,https://www.naukri.com/job-listings-junior-software-developer-fresher-2024-batch-ficusoft-technologies-chennai-tamil-nadu-0-to-1-years-220324007073
Java Developer,Ciar Software Solutions,0-2 Yrs,Not disclosed,Chennai,span,"Java, AngularJS, CSS, jQuery, Spring MVC, MYSQL, JavaScript, HTML",8 Days Ago,https://www.naukri.com/job-listings-java-developer-ciar-software-solutions-chennai-0-to-2-years-150324912559
"Hiring For Fresher JAVA Developer - Leading IT Company, Chennai...",JTS Jobs Consultancy,0 Yrs,2.5-3.5 Lacs PA,Chennai,span,"Java, Spring Mvc, Spring Boot, Core Java, Oracle, BCA, B.Sc, Java Programming",Few Hours Ago,https://www.naukri.com/job-listings-hiring-for-fresher-java-developer-leading-it-company-chennai-jts-jobs-consultancy-chennai-0-to-0-years-170224003109
Java Developer - Interested candidate fill the form.,JTS Jobs Consultancy,0 Yrs,2.5-3.5 Lacs PA,Chennai,span,"Java, Spring Mvc, Spring Boot, Core Java, Oracle, BCA, B.Sc, Java Programming",Few Hours Ago,https://www.naukri.com/job-listings-java-developer-interested-candidate-fill-the-form-jts-jobs-consultancy-chennai-0-to-0-years-080224004534
Urgent requiement For Software Developer and Testing - Chennai,Z-tech Solutions,0-1 Yrs,1.75-3 Lacs PA,Chennai,span,"node js, Java, phython, testing, software developer, flutter, android, php",18 Days Ago,https://www.naukri.com/job-listings-urgent-requiement-for-software-developer-and-testing-chennai-z-tech-solutions-chennai-0-to-1-years-050324007873
Java Developer,CIAR Software Solutions Pvt Ltd,0-2 Yrs,Not disclosed,Chennai,span,"spring boot, CSS, Spring mvc, jQuery, Coding, Web application, MySQL, Javascript",30+ Days Ago,https://www.naukri.com/job-listings-java-developer-ciar-software-solutions-pvt-ltd-chennai-0-to-2-years-131023500939
Java Developer,Oramate Technology,0-2 Yrs,Not disclosed,Chennai,span,"Database architecture, Intranet, Web development, Tools, Application, Scripting, Database design, Java",30+ Days Ago,https://www.naukri.com/job-listings-java-developer-oramate-technology-chennai-0-to-2-years-310817502884
Java Developer,Webnexus,0-2 Yrs,Not disclosed,Chennai,span,"JSP servlets, Web technologies, XML, Struts, JSON, Spring, SOAP, Java Development",30+ Days Ago,https://www.naukri.com/job-listings-java-developer-webnexs-chennai-0-to-2-years-251120501621
Java Developer,Falcon Smart It,0-2 Yrs,Not disclosed,Chennai,span,"System testing, Core Java, CSS, MIN, Coding, Time management, MySQL, HTML",30+ Days Ago,https://www.naukri.com/job-listings-java-developer-falcon-smart-it-chennai-0-to-2-years-141122502836
Java Developer,Milkomeda Technologies,0-3 Yrs,Not disclosed,Chennai,span,"Hibernate, Core Java, Tomcat, Linux, JSP, Postgresql, MySQL, Agile",30+ Days Ago,https://www.naukri.com/job-listings-java-developer-milkomeda-technologies-pvt-ltd-chennai-0-to-3-years-030822500453
"Software Engineer, developer / Programmer, 2023 graduate Can also appl",Creative Hands HR,0-1 Yrs,5-7 Lacs PA,"Chennai, Kolkata, Mumbai, Maharashtra, Hyderabad/Secunderabad, Ranchi, Jharkhand, Bangalore/Bengaluru",span,"freshers, Software Engineering, software developer, c++, python, c, dotnet, software testing",Today,https://www.naukri.com/job-listings-software-engineer-developer-programmer-2023-graduate-can-also-appl-creative-hands-hr-kolkata-mumbai-maharashtra-hyderabad-secunderabad-ranchi-jharkhand-chennai-bangalore-bengaluru-0-to-1-years-131223004493
Software developer,Webilesk Infotech,0-1 Yrs,Not disclosed,Chennai,span,"Front end, Web technologies, Javascript, PHP, JPEG, MVC, SQL, CSS3",30+ Days Ago,https://www.naukri.com/job-listings-software-developer-webilesk-infotech-chennai-0-to-1-years-170723500462
