Title,Company,Experience,Salary,Location,Description,Tags,Posted,URL
"Hiring For Fresher JAVA Developer - Leading IT Company, Chennai...",JTS Jobs Consultancy,0 Yrs,2.5-3.5 Lacs PA,Chennai,,"Java, Core Java, BCA, B.Sc, Spring Mvc, BE/B.Tech, J2Ee, MCA",1 Day Ago,https://www.naukri.com/job-listings-hiring-for-fresher-java-developer-leading-it-company-chennai-jts-jobs-consultancy-chennai-0-to-0-years-280423008563
"Hiring For Fresher JAVA Developer - Leading IT Company, Chennai...",JTS Jobs Consultancy,0 Yrs,2.5-3.5 Lacs PA,Chennai,,"Java, Spring Mvc, Spring Boot, Core Java, Oracle, BCA, B.Sc, Java Programming",1 Day Ago,https://www.naukri.com/job-listings-hiring-for-fresher-java-developer-leading-it-company-chennai-jts-jobs-consultancy-chennai-0-to-0-years-170224003109
Java Developer - Interested candidate fill the form.,JTS Jobs Consultancy,0 Yrs,2.5-3.5 Lacs PA,Chennai,,"Java, Spring Mvc, Spring Boot, Core Java, Oracle, BCA, B.Sc, Java Programming",1 Day Ago,https://www.naukri.com/job-listings-java-developer-interested-candidate-fill-the-form-jts-jobs-consultancy-chennai-0-to-0-years-080224004534
Fresher Graduate,,,,,,,,
Back End Developer,,,,,,,,
Android Developer,,,,,,,,
Devops Engineer,,,,,,,,
Python Software Developer,,,,,,,,
Software Developer,LateShipment.com,0-2 Yrs,Not disclosed,Chennai,,"Core Java, Automation, jQuery, Coding, MySQL, Wordpress, Agile, PHP",1 Day Ago,https://www.naukri.com/job-listings-software-developer-lateshipment-com-chennai-0-to-2-years-220324500632
"Software Engineer, developer / Programmer, 2023 graduate Can also appl",Creative Hands HR,0-1 Yrs,5-7 Lacs PA,"Chennai, Kolkata, Mumbai, Maharashtra, Hyderabad/Secunderabad, Ranchi, Jharkhand, Bangalore/Bengaluru",,"freshers, Software Engineering, software developer, c++, python, c, dotnet, software testing",1 Day Ago,https://www.naukri.com/job-listings-software-engineer-developer-programmer-2023-graduate-can-also-appl-creative-hands-hr-kolkata-mumbai-maharashtra-hyderabad-secunderabad-ranchi-jharkhand-chennai-bangalore-bengaluru-0-to-1-years-131223004493
Junior Software Developer Fresher 2024 Batch,Ficusoft Technologies,0-1 Yrs,3-6 Lacs PA,"Chennai, Tamil Nadu",,"Coding, Programming, CSS, Software Engineering, Computer Science, HTML, Languages, Development",1 Day Ago,https://www.naukri.com/job-listings-junior-software-developer-fresher-2024-batch-ficusoft-technologies-chennai-tamil-nadu-0-to-1-years-220324007073
Software Developer - Back End,Carisma Solutions,0-2 Yrs,Not disclosed,"Chennai, Tamil Nadu",,"Dotnet, Netsuite, Java Application Development, Backend Development, SQL, Development, Application, Software",2 Days Ago,https://www.naukri.com/job-listings-software-developer-back-end-carisma-solutions-chennai-tamil-nadu-0-to-2-years-210324005749
"Software Developer Intern (Remote, UK)",Abito Exim,,Unpaid,Remote,,,Starts within 1 month,https://www.naukri.com/job-listings-software-developer-intern-remote-uk-abito-exim-chennai-0-to-1-years-210324012248
Developer,BNP Paribas,0-1 Yrs,Not disclosed,"Chennai, Mumbai",,"kubernetes, css, bootstrap, jquery, microservices, docker, sql, plsql",5 Days Ago,https://www.naukri.com/job-listings-developer-bnp-paribas-mumbai-chennai-0-to-1-years-180324502673
Software Engineer- Development side,Software Company,0-3 Yrs,2.5-4 Lacs PA,"Chennai, Hyderabad, Telangana, Bengaluru",,"fresher, Application Programming, Java, Software Development, Fullstack Development, Software Engineering, Java Programming, Software Design",2 Days Ago,https://www.naukri.com/job-listings-software-engineer-development-side-swagatham-resource-management-india-hyderabad-telangana-chennai-bengaluru-0-to-3-years-080923009901
Application Developer Trainee,Fujitsu,0-1 Yrs,Not disclosed,"Chennai, Noida, Hyderabad, Pune, Bengaluru",,"Computer science, Object oriented design, Cloud computing, GIT, Javascript, Data structures, Information technology, SDLC",2 Days Ago,https://www.naukri.com/job-listings-application-developer-trainee-fujitsu-consulting-india-pvt-ltd-noida-hyderabad-pune-chennai-bengaluru-0-to-1-years-210324500905
Fullstack Developer,Testpress Tech Labs Llp,0-1 Yrs,3.5-4.5 Lacs PA,Chennai(Old Pallavaram),,"Problem Solving, Javascript, Python, Bug Fixing, Technical Support, Deploying Code, Kotlin, Bug",4 Days Ago,https://www.naukri.com/job-listings-fullstack-developer-testpress-tech-labs-llp-chennai-0-to-1-years-190324005598
Front END Developer,Nexpro247,0-5 Yrs,3-8 Lacs PA,"Hybrid - Chennai, Tamil Nadu, Hyderabad, Telangana, Bengaluru, Karnataka",,"Front End, Frontend Development, Front End Design, html5, Opencart, Dreamweaver, Shopify, Web Designing",1 Day Ago,https://www.naukri.com/job-listings-front-end-developer-nexpro247-hyderabad-telangana-chennai-tamil-nadu-bengaluru-karnataka-0-to-5-years-160224003527
Python Developer II Java Full Stack Developer- WFH Freshers,Ustron Dx Premium,0-5 Yrs,5-15 Lacs PA,"Hybrid - Chennai, Hyderabad, Pune, Ahmedabad, Bengaluru, Mumbai (All Areas)",,"Python Framework, Python Testing, Java Development, Python Development, Python, Java, Cloud Foundry, Java Web Services",Today,https://www.naukri.com/job-listings-python-developer-ii-java-full-stack-developer-wfh-freshers-ustron-dx-hyderabad-pune-ahmedabad-chennai-bengaluru-mumbai-all-areas-0-to-5-years-240324000131
"MTS 1, Software Engineer",Xoom,0-3 Yrs,Not disclosed,"Chennai, Bengaluru",,"Automation, Employee engagement, Javascript, Agile, Software development life cycle, Manager Technology, Business strategy, Operations",1 Day Ago,https://www.naukri.com/job-listings-mts-1-software-engineer-xoom-inc-chennai-bengaluru-0-to-3-years-220324500306
Trainee PHP Software Engineer,Whereitz Technology,0-2 Yrs,Not disclosed,Chennai,,"OOPS, MySQL, Javascript, PHP, LAMP, CSS, Analytical Skills, WAMP",4 Days Ago,https://www.naukri.com/job-listings-trainee-php-software-engineer-whereitz-technology-chennai-0-to-2-years-190324010009
Excellent Opening For APM,Computer Age Management Services (CAMS),0-4 Yrs,Not disclosed,"Chennai, Tamil Nadu",,"IIT Madras, IIT Delhi, Product Life Cycle, Product Intern, APM, Product Strategy, IIM Bangalore, Product Management",1 Day Ago,https://www.naukri.com/job-listings-excellent-opening-for-apm-computer-age-management-services-cams-chennai-tamil-nadu-0-to-4-years-170124008044
Java Developer,Nexpro247,0-5 Yrs,4-9 Lacs PA,"Chennai, Tamil Nadu, Hyderabad, Telangana, Bengaluru, Karnataka",,"Java Programming, Java Development, Java Coding, J2Ee Technologies, Java Servlets, OOPS, Java Web Services, Spring Boot",5 Days Ago,https://www.naukri.com/job-listings-java-developer-nexpro247-hyderabad-telangana-chennai-tamil-nadu-bengaluru-karnataka-0-to-5-years-180324003051
Jr. Custom Service Executive,Tata Communications,0-4 Yrs,Not disclosed,Chennai,,"Order management, Telecom, Basic, Network design, Networking, Service Executive, Scheduling, Operations",2 Days Ago,https://www.naukri.com/job-listings-jr-custom-service-executive-tata-communications-ltd-chennai-0-to-4-years-210324501994
Web Development (Full stack) Internship,Varnaa Studio,,"15,000/month","Chennai, Tamil Nadu(Nungambakkam)",,,Starts in 1-3 months,https://www.naukri.com/job-listings-web-development-full-stack-internship-varnaa-studio-chennai-tamil-nadu-0-to-1-years-220324011252
Corporate Relationship Manager,Nxtwave Disruptive Technologies,0-5 Yrs,6-10 Lacs PA,"Chennai, Tamil Nadu, Hyderabad, Telangana, Bengaluru, Karnataka",,"B2B Sales, Corporate Relations, Key Account Management, Strategic Partnerships, Placement Coordination, Corporate Sales, Accounting, Account management",2 Days Ago,https://www.naukri.com/job-listings-corporate-relationship-manager-nxtwave-disruptive-technologies-hyderabad-telangana-chennai-tamil-nadu-bengaluru-karnataka-0-to-5-years-210324009178
Dot Net & Angular Professional,Rogersoft,0-5 Yrs,Not disclosed,Chennai,,".Net & Angular (trained freshers/experienced), .Net, Angular, DoT, Training",3 Days Ago,https://www.naukri.com/job-listings-dot-net-angular-professional-rogersoft-chennai-0-to-5-years-200324501974
Business Development Associate,Qift Solutech,0-4 Yrs,5.5-6 Lacs PA,"Chennai, Tamil Nadu, Bengaluru",,"Inside Sales, Business Development, Communication Skills, Cold Calling, Sales, Calling, Cold, Development",6 Days Ago,https://www.naukri.com/job-listings-business-development-associate-qift-solutech-chennai-tamil-nadu-bengaluru-0-to-4-years-100124011973
Technical Service Trainee,Fujitsu,0-1 Yrs,Not disclosed,Chennai,,"servicenow, web technologies, Technical, Servicing, Training, Technical services",3 Days Ago,https://www.naukri.com/job-listings-technical-service-trainee-fujitsu-consulting-india-pvt-ltd-chennai-0-to-1-years-200324501760
AWS DevOps openings in Accenture,VSS Technologies,0-4 Yrs,6-12 Lacs PA,"Hybrid - Chennai, Tamil Nadu, Hyderabad/ Secunderabad, Telangana, Bangalore/ Bengaluru, Karnataka",,"Devops, Aws Security, Devops Jenkins, Aws Cloud, Devops Ci Cd, Devsecops, Pipeline, Jenkins",4 Days Ago,https://www.naukri.com/job-listings-aws-devops-openings-in-accenture-shiva-shakthi-technologies-hyderabad-secunderabad-telangana-chennai-tamil-nadu-bangalore-bengaluru-karnataka-0-to-4-years-190324008670
Java & Spring boot Developer,RAO It Solutions,0-5 Yrs,3-8 Lacs PA,"Chennai, Delhi / NCR, Mumbai (All Areas)",,"Java, C++, Spring Boot, J2Ee, Fullstack Development, Hibernate, C, JSP",3 Days Ago,https://www.naukri.com/job-listings-java-spring-boot-developer-rao-it-solutions-chennai-delhi-ncr-mumbai-all-areas-0-to-5-years-210324003945
Frontend Developer,Nexpro247,0-5 Yrs,3.5-8.5 Lacs PA,"Chennai, Tamil Nadu, Hyderabad, Telangana, Bengaluru, Karnataka",,"Front End, Frontend Development, Web Development, Front-end Development, Dreamweaver, HTML, Shopify, Web Designing",4 Days Ago,https://www.naukri.com/job-listings-frontend-developer-nexpro247-hyderabad-telangana-chennai-tamil-nadu-bengaluru-karnataka-0-to-5-years-190324006822
Junior Software Engineer,RAO It Solutions,0-5 Yrs,3-8 Lacs PA,"Chennai, Delhi / NCR, Mumbai (All Areas)",,"JAVA, Testing Tools, .NET, software engineer, software developer, C#, C++, HTML",3 Days Ago,https://www.naukri.com/job-listings-junior-software-engineer-rao-it-solutions-chennai-delhi-ncr-mumbai-all-areas-0-to-5-years-210324003960
Flutter Developer,,,,,,,,
Software Test Developer,,,,,,,,
